{"$schema":"https://json-schema.org/draft/2020-12/schema","$id":"urn:home-energy:test-demo:1.0.0","type":"object","additionalProperties":false,"required":["schema_version","model_version","split","population_rows","sample_count","selection_rule","feature_order","sources","transformation","rows"],"properties":{"schema_version":{"const":"1.0.0"},"model_version":{"const":"mlr-1.0.0"},"split":{"const":"TEST"},"population_rows":{"const":2962},"sample_count":{"const":12},"selection_rule":{"type":"string"},"feature_order":{"type":"array","items":{"type":"string"},"minItems":15,"maxItems":15},"sources":{"type":"object","additionalProperties":{"type":"string"}},"transformation":{"type":"string"},"rows":{"type":"array","minItems":12,"maxItems":12,"items":{"type":"object","additionalProperties":false,"required":["sample_id","test_row_index_0based","dataset_row_index_0based","source_csv_line_1based","input","actual","saved"],"properties":{"sample_id":{"type":"string"},"test_row_index_0based":{"type":"integer","minimum":0},"dataset_row_index_0based":{"type":"integer","minimum":0},"source_csv_line_1based":{"type":"integer","minimum":0},"input":{"type":"object","additionalProperties":false,"required":["T1","RH_1","T3","RH_3","T4","T5","RH_5","T7","RH_8","T9","RH_9","Windspeed","Visibility","Tdewpoint","Hour","date"],"properties":{"T1":{"type":"number"},"RH_1":{"type":"number"},"T3":{"type":"number"},"RH_3":{"type":"number"},"T4":{"type":"number"},"T5":{"type":"number"},"RH_5":{"type":"number"},"T7":{"type":"number"},"RH_8":{"type":"number"},"T9":{"type":"number"},"RH_9":{"type":"number"},"Windspeed":{"type":"number"},"Visibility":{"type":"number"},"Tdewpoint":{"type":"number"},"Hour":{"type":"number"},"date":{"type":"string"}}},"actual":{"type":"number"},"saved":{"type":"object","required":["predicted","lower","upper","interval_valid","warnings","residual","absolute_error"],"additionalProperties":false,"properties":{"predicted":{"type":"number"},"lower":{"type":"number"},"upper":{"type":"number"},"residual":{"type":"number"},"absolute_error":{"type":"number"},"interval_valid":{"type":"boolean"},"warnings":{"type":"array","items":{"type":"string","enum":["NEGATIVE_ESTIMATE_WARNING","INVALID_INTERVAL"]}}}}}}}}}
