{"schema_version":"1.0.0","model_version":"mlr-1.0.0","split":"TEST","population_rows":2962,"sample_count":12,"selection_rule":"index=floor(i*(2962-1)/11), i=0..11; independent of Actual, Prediction and Error","feature_order":["T1","RH_1","T3","RH_3","T4","T5","RH_5","T7","RH_8","T9","RH_9","Windspeed","Visibility","Tdewpoint","Hour"],"sources":{"data/raw/energydata_complete.csv":"2820bf712ad0275cb18b85a05250926100d8e65ebb9f4d2d016ca91ea152a25d","reports/evaluation/c2-mlr-1.0.0/predictions.csv":"a7cc7c0f62b48a19ee4ceb5300b6d0eced850e439be4b82d9e6d31c710df3471","reports/evaluation/c2-mlr-1.0.0/test_design.csv":"12924a6433b251f8b192791b4c02e0bad3c2817771f297a37dea661a0207c18e","reports/data/split_manifest.json":"44f5e000c2a2338c7640b9975cf39fe6de1f952f8465757e048aba1953ead727","reports/data/provenance.json":"cfd8dbc8470b7466133c145675694d3e80ed0e7c005f47ac1783bef3a977e1a7"},"transformation":"Exact original numeric cells + source-calendar Hour; join saved C2 by timestamp; verify standardized design. Exporter calls no estimator. Browser predicts only 12 chosen samples, never recomputes population metrics.","rows":[{"sample_id":"TEST-0000","test_row_index_0based":0,"dataset_row_index_0based":16773,"source_csv_line_1based":16775,"input":{"T1":23.79,"RH_1":37.99,"T3":24.5,"RH_3":38.2,"T4":23.6,"T5":21.1,"RH_5":48.06,"T7":22.79,"RH_8":43.06,"T9":21.79,"RH_9":43.4,"Windspeed":1.0,"Visibility":40.0,"Tdewpoint":5.4,"Hour":4,"date":"2016-05-07 04:30:00"},"actual":60.0,"saved":{"predicted":61.1900489372255,"lower":0.0,"upper":246.5471703734249,"interval_valid":true,"warnings":[],"residual":-1.190048937225498,"absolute_error":1.190048937225498}},{"sample_id":"TEST-0269","test_row_index_0based":269,"dataset_row_index_0based":17042,"source_csv_line_1based":17044,"input":{"T1":24.5,"RH_1":38.5,"T3":26.39,"RH_3":38.2,"T4":24.73,"T5":23.4633333333333,"RH_5":39.56,"T7":24.29,"RH_8":41.4,"T9":23.2385714285714,"RH_9":43.47,"Windspeed":2.0,"Visibility":40.0,"Tdewpoint":8.46666666666667,"Hour":1,"date":"2016-05-09 01:20:00"},"actual":50.0,"saved":{"predicted":75.57826141579989,"lower":0.0,"upper":260.9353828519993,"interval_valid":true,"warnings":[],"residual":-25.578261415799886,"absolute_error":25.578261415799886}},{"sample_id":"TEST-0538","test_row_index_0based":538,"dataset_row_index_0based":17311,"source_csv_line_1based":17313,"input":{"T1":25.0,"RH_1":48.0,"T3":26.29,"RH_3":43.79,"T4":25.1,"T5":24.29,"RH_5":62.2,"T7":24.6,"RH_8":52.96,"T9":24.0,"RH_9":47.29,"Windspeed":2.0,"Visibility":40.0,"Tdewpoint":12.8333333333333,"Hour":22,"date":"2016-05-10 22:10:00"},"actual":60.0,"saved":{"predicted":81.82414684725168,"lower":0.0,"upper":267.1812682834511,"interval_valid":true,"warnings":[],"residual":-21.824146847251683,"absolute_error":21.824146847251683}},{"sample_id":"TEST-0807","test_row_index_0based":807,"dataset_row_index_0based":17580,"source_csv_line_1based":17582,"input":{"T1":25.6,"RH_1":49.36,"T3":26.2,"RH_3":45.4,"T4":25.5,"T5":24.1,"RH_5":51.76,"T7":25.1,"RH_8":48.7,"T9":24.2,"RH_9":47.09,"Windspeed":2.0,"Visibility":40.0,"Tdewpoint":11.4,"Hour":19,"date":"2016-05-12 19:00:00"},"actual":130.0,"saved":{"predicted":111.50294084990219,"lower":0.0,"upper":296.8600622861016,"interval_valid":true,"warnings":[],"residual":18.49705915009781,"absolute_error":18.49705915009781}},{"sample_id":"TEST-1076","test_row_index_0based":1076,"dataset_row_index_0based":17849,"source_csv_line_1based":17851,"input":{"T1":25.0333333333333,"RH_1":31.9266666666667,"T3":23.4633333333333,"RH_3":29.4933333333333,"T4":24.2,"T5":23.7771428571429,"RH_5":39.9971428571429,"T7":24.73,"RH_8":34.0671428571429,"T9":23.5,"RH_9":32.41,"Windspeed":7.16666666666667,"Visibility":40.0,"Tdewpoint":1.33333333333333,"Hour":15,"date":"2016-05-14 15:50:00"},"actual":130.0,"saved":{"predicted":8.639662821298842,"lower":0.0,"upper":193.99678425749823,"interval_valid":true,"warnings":[],"residual":121.36033717870116,"absolute_error":121.36033717870116}},{"sample_id":"TEST-1345","test_row_index_0based":1345,"dataset_row_index_0based":18118,"source_csv_line_1based":18120,"input":{"T1":22.89,"RH_1":38.56,"T3":24.62,"RH_3":37.09,"T4":23.1666666666667,"T5":22.6,"RH_5":40.116,"T7":23.2,"RH_8":37.9,"T9":22.89,"RH_9":38.0,"Windspeed":1.0,"Visibility":35.6666666666667,"Tdewpoint":4.06666666666667,"Hour":12,"date":"2016-05-16 12:40:00"},"actual":120.0,"saved":{"predicted":91.40100638309136,"lower":0.0,"upper":276.75812781929073,"interval_valid":true,"warnings":[],"residual":28.598993616908643,"absolute_error":28.598993616908643}},{"sample_id":"TEST-1615","test_row_index_0based":1615,"dataset_row_index_0based":18388,"source_csv_line_1based":18390,"input":{"T1":23.39,"RH_1":42.9,"T3":24.29,"RH_3":38.9666666666667,"T4":23.29,"T5":21.2385714285714,"RH_5":46.3428571428571,"T7":23.0,"RH_8":43.156,"T9":22.6,"RH_9":41.834,"Windspeed":4.0,"Visibility":26.6666666666667,"Tdewpoint":9.4,"Hour":9,"date":"2016-05-18 09:40:00"},"actual":80.0,"saved":{"predicted":82.34400085220169,"lower":0.0,"upper":267.7011222884011,"interval_valid":true,"warnings":[],"residual":-2.344000852201688,"absolute_error":2.344000852201688}},{"sample_id":"TEST-1884","test_row_index_0based":1884,"dataset_row_index_0based":18657,"source_csv_line_1based":18659,"input":{"T1":23.0,"RH_1":43.09,"T3":24.5,"RH_3":39.5,"T4":22.7,"T5":21.8185714285714,"RH_5":50.1214285714286,"T7":22.7,"RH_8":44.356,"T9":22.6333333333333,"RH_9":44.5,"Windspeed":4.0,"Visibility":34.5,"Tdewpoint":9.8,"Hour":6,"date":"2016-05-20 06:30:00"},"actual":60.0,"saved":{"predicted":71.60932831712759,"lower":0.0,"upper":256.96644975332697,"interval_valid":true,"warnings":[],"residual":-11.609328317127591,"absolute_error":11.609328317127591}},{"sample_id":"TEST-2153","test_row_index_0based":2153,"dataset_row_index_0based":18926,"source_csv_line_1based":18928,"input":{"T1":24.6172727272727,"RH_1":50.5945454545455,"T3":26.9954545454545,"RH_3":44.7272727272727,"T4":23.9252252252252,"T5":22.8477477477477,"RH_5":53.1131981981982,"T7":23.7927927927928,"RH_8":52.1363636363636,"T9":23.2036363636364,"RH_9":49.1272727272727,"Windspeed":1.66666666666667,"Visibility":40.0,"Tdewpoint":13.4,"Hour":3,"date":"2016-05-22 03:20:00"},"actual":60.0,"saved":{"predicted":110.64964699121599,"lower":0.0,"upper":296.0067684274154,"interval_valid":true,"warnings":[],"residual":-50.64964699121599,"absolute_error":50.64964699121599}},{"sample_id":"TEST-2422","test_row_index_0based":2422,"dataset_row_index_0based":19195,"source_csv_line_1based":19197,"input":{"T1":24.6,"RH_1":44.79,"T3":26.0,"RH_3":43.0,"T4":24.2,"T5":23.5,"RH_5":55.7971428571429,"T7":23.4842857142857,"RH_8":49.09,"T9":22.79,"RH_9":44.86,"Windspeed":3.83333333333333,"Visibility":38.1666666666667,"Tdewpoint":8.66666666666667,"Hour":0,"date":"2016-05-24 00:10:00"},"actual":50.0,"saved":{"predicted":78.45421951870858,"lower":0.0,"upper":263.811340954908,"interval_valid":true,"warnings":[],"residual":-28.454219518708584,"absolute_error":28.454219518708584}},{"sample_id":"TEST-2691","test_row_index_0based":2691,"dataset_row_index_0based":19464,"source_csv_line_1based":19466,"input":{"T1":24.3363636363636,"RH_1":37.9254545454545,"T3":24.8690909090909,"RH_3":36.9954545454545,"T4":24.1263636363636,"T5":21.3718181818182,"RH_5":50.3934090909091,"T7":23.3554545454545,"RH_8":41.155,"T9":22.1,"RH_9":38.9009090909091,"Windspeed":2.0,"Visibility":26.0,"Tdewpoint":8.4,"Hour":21,"date":"2016-05-25 21:00:00"},"actual":70.0,"saved":{"predicted":100.4333917695794,"lower":0.0,"upper":285.7905132057788,"interval_valid":true,"warnings":[],"residual":-30.4333917695794,"absolute_error":30.4333917695794}},{"sample_id":"TEST-2961","test_row_index_0based":2961,"dataset_row_index_0based":19734,"source_csv_line_1based":19736,"input":{"T1":25.5,"RH_1":46.6,"T3":26.8233333333333,"RH_3":41.1566666666667,"T4":24.7,"T5":23.2,"RH_5":52.2,"T7":24.5,"RH_8":49.736,"T9":23.2,"RH_9":46.845,"Windspeed":4.0,"Visibility":27.0,"Tdewpoint":13.2,"Hour":18,"date":"2016-05-27 18:00:00"},"actual":430.0,"saved":{"predicted":105.01646255909485,"lower":0.0,"upper":290.37358399529427,"interval_valid":true,"warnings":[],"residual":324.98353744090514,"absolute_error":324.98353744090514}}]}
